{
  "authenticated": false,
  "api_profile": {
    "major": 1,
    "minor": 0
  },
  "engine_instance_id": "550e8400-e29b-41d4-a716-446655440000",
  "instance_nonce": "rendezvous-nonce-7f3a",
  "capabilities": {
    "features": {
      "tools": "supported",
      "compaction": "unknown"
    }
  }
}
